<?xml version="1.0"?>
<!DOCTYPE Report
[
<!ELEMENT Report (General ,(Doc|BPT)) >
<!ATTLIST Report ver CDATA #REQUIRED tmZone CDATA #REQUIRED>

<!ELEMENT General ( DocLocation ) >
<!ATTLIST General productName CDATA #REQUIRED productVer CDATA #REQUIRED os CDATA #REQUIRED host CDATA #REQUIRED qcserver CDATA #IMPLIED qcproject CDATA #IMPLIED SolManSolutionId CDATA #IMPLIED SolManProjectId CDATA #IMPLIED SolManTestPlanId CDATA #IMPLIED SolManTestPackageId CDATA #IMPLIED SolManUserInfoData CDATA #IMPLIED  >

<!ELEMENT BPT (DName,Res,DVer?,TSet?,TInst?,NodeArgs,AdditionalInfo*,Doc*) >
<!ATTLIST BPT rID ID #REQUIRED >

<!ELEMENT Doc (DName,ConfName?,Res,DVer?,TSet?,TInst?,RunType?,DT?,AdditionalInfo*,Step*,DIter*,Step*,Action*,Doc*,Summary?,TestMaintenanceSummary*,NodeArgs?) >
<!ATTLIST Doc rID ID #REQUIRED type (Test|BC|BPTWrapperTest|Flow|Group|Action) "Test" productName CDATA #REQUIRED BCIter CDATA #IMPLIED >

<!ELEMENT RunType ( #PCDATA )>
<!ATTLIST RunType fmStep (False|True) "False" batch (False|True) "False" upDesc (False|True) "False" upChk (False|True) "False" upAS (False|True) "False">

<!ELEMENT DName ( #PCDATA ) >

<!ELEMENT ConfName ( #PCDATA ) >

<!ELEMENT Res ( #PCDATA ) >

<!ELEMENT AdditionalInfo (AdditionalDataName,AdditionalDataValue ) >

<!ELEMENT AdditionalDataName ( #PCDATA ) >

<!ELEMENT AdditionalDataValue ( #PCDATA ) >

<!ELEMENT DVer ( #PCDATA ) >

<!ELEMENT TSet ( #PCDATA ) >

<!ELEMENT TInst ( #PCDATA ) >

<!ELEMENT DIter (Step*,Action+,Summary?,NodeArgs)>
<!ATTLIST DIter rID ID #REQUIRED iterID CDATA #REQUIRED>

<!ELEMENT DocLocation ( #PCDATA )>

<!ELEMENT Action (AName,AIter*,(Step|HtmlStep|Action)*, Summary,ActionMaintenanceSummary*, NodeArgs ) >
<!ATTLIST Action rID ID #REQUIRED>

<!ELEMENT AIter ((Step|HtmlStep|Action)*,DataMapping?, Summary?,NodeArgs) >
<!ATTLIST AIter rID ID #REQUIRED iterID CDATA #REQUIRED isCountable (False|True) "False" >

<!ELEMENT AName ( #PCDATA ) >

<!ELEMENT TestMaintenanceSummary (ActionMaintenanceSummary*) >
<!ATTLIST TestMaintenanceSummary ObjectsAdded CDATA #REQUIRED ObjectsUpdated CDATA #REQUIRED StepsUpdated CDATA #REQUIRED StepsComments CDATA #REQUIRED><!ELEMENT ActionMaintenanceSummary (ObjectChange* ) >
<!ATTLIST ActionMaintenanceSummary Action CDATA #REQUIRED Objects CDATA #REQUIRED Updated CDATA #REQUIRED LinesTotal CDATA #REQUIRED Added CDATA #REQUIRED LinesUpdated CDATA #REQUIRED>

<!ELEMENT ObjectChange  (Hierarchy, PropertyChangeList* ) >
<!ATTLIST ObjectChange Operation CDATA #IMPLIED OriginalRepository CDATA #IMPLIED>

<!ELEMENT PropertyChangeList (PropertyDef*) >

<!ELEMENT PropertyDef (OriginalValue, NewValue) >
<!ATTLIST PropertyDef PropName CDATA #REQUIRED OriginRegularExpression (True|False) "False" NewRegularExpression (True|False) "False" AddedProperty (True|False) "False" >

<!ELEMENT OriginalValue ( #PCDATA )>

<!ELEMENT NewValue ( #PCDATA )>

<!ELEMENT Hierarchy  (ObjectName, Hierarchy*) >
<!ATTLIST Hierarchy MicClass CDATA #REQUIRED>

<!ELEMENT ObjectName  ( #PCDATA ) >

<!ELEMENT Step (Obj,Details,Time,TimeTick* ,(Step|HtmlStep|Doc)*, DataMapping?, NodeArgs) >
<!ATTLIST Step rID ID #REQUIRED retval CDATA #IMPLIED>

<!ELEMENT HtmlStep (HTML,TimeTick*,(Step|HtmlStep|Doc)*,NodeArgs) >
<!ATTLIST HtmlStep rID ID #REQUIRED >

<!ELEMENT Obj ( #PCDATA ) >
<!ATTLIST Obj plainTxt (False|True) "True">

<!ELEMENT Details ( #PCDATA ) >
<!ATTLIST Details plainTxt (False|True) "True">

<!ELEMENT Time ( #PCDATA ) >

<!ELEMENT HTML ( #PCDATA ) >

<!ELEMENT Disp ( #PCDATA ) >

<!ELEMENT TimeTick ( #PCDATA ) >

<!ELEMENT DataMapping ( DataMappedItem* )>
<!ELEMENT DataMappedItem EMPTY >
<!ATTLIST DataMappedItem dsName CDATA #REQUIRED >
<!ATTLIST DataMappedItem rowId CDATA #REQUIRED >

<!ELEMENT NodeArgs (Disp,TopPane?,BtmPane?,ExtendedInfo? )>
<!ATTLIST NodeArgs eType CDATA #REQUIRED icon CDATA #REQUIRED nRep CDATA #REQUIRED UserNote CDATA #IMPLIED filter (False|True) "True">
<!ATTLIST NodeArgs status (Passed|Failed|Done|Warning|Information) "Done">
<!ATTLIST NodeArgs iconSel CDATA #IMPLIED nType CDATA #IMPLIED MovieMarker CDATA "">
<!ATTLIST NodeArgs Source CDATA #IMPLIED SourceLine CDATA #IMPLIED StepFlowItemKey CDATA #IMPLIED >

<!ELEMENT TopPane (Path)>

<!ELEMENT BtmPane ( (Path|WR)?,ASHilite?)>
<!ATTLIST BtmPane vType CDATA "HTML">

<!ELEMENT Path ( #PCDATA ) >

<!ELEMENT ASHilite ( #PCDATA ) >

<!ELEMENT WR ( #PCDATA ) >

<!ELEMENT ExtendedInfo ( StepData ) >

<!ATTLIST ExtendedInfo StepType CDATA #REQUIRED>
<!ELEMENT DT (NodeArgs) >
<!ATTLIST DT rID ID #REQUIRED>

<!ELEMENT Summary (Param*)>
<!ATTLIST Summary sTime CDATA #IMPLIED eTime CDATA #IMPLIED passed CDATA #IMPLIED failed CDATA #IMPLIED warnings CDATA #IMPLIED retval CDATA #IMPLIED stopped (False|True) "False" >

<!ELEMENT Param (ParamName,ParamVal)+ >
<!ATTLIST Param paramInOut (In|Out) "In">

<!ELEMENT ParamName ( #PCDATA ) >

<!ELEMENT ParamVal ( #PCDATA ) >

]
>
<Report ver="2.0" tmZone="India Standard Time">
<General productName="HPE Unified Functional Testing" productVer="14.03" os="" host="DIKSHA"><DocLocation><![CDATA[D:\KeywordDrivenFramework\Driver\Driver]]></DocLocation></General>
<Doc rID="T1"   productName= "HPE Unified Functional Testing"  >
<DName><![CDATA[Driver]]></DName>
<Res><![CDATA[Res43]]></Res>
<DT rID="T2">
<NodeArgs eType="Table" icon="2" nRep="4" filter="False" >
<Disp><![CDATA[Run-Time Data Table]]></Disp>
<BtmPane vType="Table" >
<Path><![CDATA[Default.xls]]></Path>
</BtmPane>
</NodeArgs>
</DT>
<Action rID="T3">
<AName><![CDATA[Action1]]></AName>
<Step rID="T4">
<Obj plainTxt="False" ><![CDATA[tr1]]></Obj>
<Details plainTxt="False" ><![CDATA[Transaction "tr1" started.]]></Details>
<Time><![CDATA[29/03/2022 - 22:58:10]]></Time>
<TimeTick>1648574890</TimeTick>
<NodeArgs eType="Transaction" icon="4" nRep="7" nType="Start Transaction" Source="Action1" SourceLine="5" >
<Disp><![CDATA[tr1]]></Disp>
</NodeArgs>
</Step>
<Step rID="T5">
<Obj plainTxt="False" ><![CDATA[Run Error]]></Obj>
<Details plainTxt="False" ><![CDATA[Type mismatch: 'Enviornment'<BR/>Function file: D:\KeywordDrivenFramework\FunctionLibr\Library2.qfl<BR/>Line (3): &quot;Systemutil.Run(Enviornment(&quot;flightpath&quot;))&quot;.]]></Details>
<Time><![CDATA[29/03/2022 - 22:58:29]]></Time>
<TimeTick>1648574909</TimeTick>
<NodeArgs eType="Replay" icon="5" nRep="8" status="Failed" Source="D:\KeywordDrivenFramework\FunctionLibr\Library2.qfl" SourceLine="2" >
<Disp><![CDATA[Run Error]]></Disp>
</NodeArgs>
</Step>
<Step rID="T6">
<Obj plainTxt="False" ><![CDATA[HPE MyFlight Sample Applicatio]]></Obj>
<Details plainTxt="False" ><![CDATA[WpfWindow]]></Details>
<Time><![CDATA[29/03/2022 - 23:00:15]]></Time>
<TimeTick>1648575015</TimeTick>
<Step rID="T7">
<Obj plainTxt="False" ><![CDATA[agentName]]></Obj>
<Details plainTxt="False" ><![CDATA[Cannot&nbsp;find&nbsp;the&nbsp;"agentName"&nbsp;object's&nbsp;parent&nbsp;"HPE&nbsp;MyFlight&nbsp;Sample&nbsp;Applicatio"&nbsp;(class&nbsp;WpfWindow).<br/>Verify&nbsp;that&nbsp;parent&nbsp;properties&nbsp;match&nbsp;an&nbsp;object&nbsp;currently&nbsp;displayed&nbsp;in&nbsp;your&nbsp;application.]]></Details>
<Time><![CDATA[29/03/2022 - 23:00:15]]></Time>
<TimeTick>1648575015</TimeTick>
<Step rID="T8">
<Obj plainTxt="False" ><![CDATA[HPE MyFlight Sample Applicatio]]></Obj>
<Details plainTxt="False" ><![CDATA[Object's physical description:<br>wpftypename = window<br>regexpwndtitle = HPE MyFlight Sample Application<br>devname = HPE MyFlight Sample Application<br>]]></Details>
<Time><![CDATA[29/03/2022 - 23:00:15]]></Time>
<TimeTick>1648575015</TimeTick>
<NodeArgs eType="Replay" icon="5" nRep="31" status="Warning" nType="Parent description" Source="D:\KeywordDrivenFramework\FunctionLibr\Library2.qfl" SourceLine="-1" >
<Disp><![CDATA[HPE MyFlight Sample Applicatio]]></Disp>
</NodeArgs>
</Step>
<NodeArgs eType="Replay" icon="7" nRep="30" status="Failed" nType="Run Error" Source="D:\KeywordDrivenFramework\FunctionLibr\Library2.qfl" SourceLine="-1" >
<Disp><![CDATA[agentName]]></Disp>
</NodeArgs>
</Step>
<NodeArgs eType="Context" icon="6" nRep="29" status="Failed" Source="D:\KeywordDrivenFramework\FunctionLibr\Library2.qfl" SourceLine="-1" >
<Disp><![CDATA[HPE MyFlight Sample Applicatio]]></Disp>
</NodeArgs>
</Step>
<Step rID="T9">
<Obj plainTxt="False" ><![CDATA[HPE MyFlight Sample Applicatio]]></Obj>
<Details plainTxt="False" ><![CDATA[WpfWindow]]></Details>
<Time><![CDATA[29/03/2022 - 23:00:15]]></Time>
<TimeTick>1648575015</TimeTick>
<Step rID="T10">
<Obj plainTxt="False" ><![CDATA[Run Error]]></Obj>
<Details plainTxt="False" ><![CDATA[Cannot find the &quot;agentName&quot; object's parent &quot;HPE MyFlight Sample Applicatio&quot; (class WpfWindow).<BR/>Verify that parent properties match an object currently displayed in your application.<BR/>Function file: D:\KeywordDrivenFramework\FunctionLibr\Library2.qfl<BR/>Line (4): &quot;WpfWindow(&quot;HPE MyFlight Sample Applicatio&quot;).WpfEdit(&quot;agentName&quot;).Set &quot;john&quot;&quot;.]]></Details>
<Time><![CDATA[29/03/2022 - 23:00:15]]></Time>
<TimeTick>1648575015</TimeTick>
<NodeArgs eType="Replay" icon="5" nRep="33" status="Failed" Source="D:\KeywordDrivenFramework\FunctionLibr\Library2.qfl" SourceLine="3" >
<Disp><![CDATA[Run Error]]></Disp>
</NodeArgs>
</Step>
<Step rID="T11">
<Obj plainTxt="False" ><![CDATA[password]]></Obj>
<Details plainTxt="False" ><![CDATA[Cannot&nbsp;find&nbsp;the&nbsp;"password"&nbsp;object's&nbsp;parent&nbsp;"HPE&nbsp;MyFlight&nbsp;Sample&nbsp;Applicatio"&nbsp;(class&nbsp;WpfWindow).<br/>Verify&nbsp;that&nbsp;parent&nbsp;properties&nbsp;match&nbsp;an&nbsp;object&nbsp;currently&nbsp;displayed&nbsp;in&nbsp;your&nbsp;application.]]></Details>
<Time><![CDATA[29/03/2022 - 23:00:38]]></Time>
<TimeTick>1648575038</TimeTick>
<Step rID="T12">
<Obj plainTxt="False" ><![CDATA[HPE MyFlight Sample Applicatio]]></Obj>
<Details plainTxt="False" ><![CDATA[Object's physical description:<br>wpftypename = window<br>regexpwndtitle = HPE MyFlight Sample Application<br>devname = HPE MyFlight Sample Application<br>]]></Details>
<Time><![CDATA[29/03/2022 - 23:00:38]]></Time>
<TimeTick>1648575038</TimeTick>
<NodeArgs eType="Replay" icon="5" nRep="43" status="Warning" nType="Parent description" Source="D:\KeywordDrivenFramework\FunctionLibr\Library2.qfl" SourceLine="-1" >
<Disp><![CDATA[HPE MyFlight Sample Applicatio]]></Disp>
</NodeArgs>
</Step>
<NodeArgs eType="Replay" icon="7" nRep="42" status="Failed" nType="Run Error" Source="D:\KeywordDrivenFramework\FunctionLibr\Library2.qfl" SourceLine="-1" >
<Disp><![CDATA[password]]></Disp>
</NodeArgs>
</Step>
<NodeArgs eType="Context" icon="6" nRep="32" status="Failed" Source="D:\KeywordDrivenFramework\FunctionLibr\Library2.qfl" SourceLine="-1" >
<Disp><![CDATA[HPE MyFlight Sample Applicatio]]></Disp>
</NodeArgs>
</Step>
<Step rID="T13">
<Obj plainTxt="False" ><![CDATA[HPE MyFlight Sample Applicatio]]></Obj>
<Details plainTxt="False" ><![CDATA[WpfWindow]]></Details>
<Time><![CDATA[29/03/2022 - 23:00:38]]></Time>
<TimeTick>1648575038</TimeTick>
<Step rID="T14">
<Obj plainTxt="False" ><![CDATA[Run Error]]></Obj>
<Details plainTxt="False" ><![CDATA[Cannot find the &quot;password&quot; object's parent &quot;HPE MyFlight Sample Applicatio&quot; (class WpfWindow).<BR/>Verify that parent properties match an object currently displayed in your application.<BR/>Function file: D:\KeywordDrivenFramework\FunctionLibr\Library2.qfl<BR/>Line (5): &quot;WpfWindow(&quot;HPE MyFlight Sample Applicatio&quot;).WpfEdit(&quot;password&quot;).SetSecure &quot;6242a97c443fd0b29eca&quot;&quot;.]]></Details>
<Time><![CDATA[29/03/2022 - 23:00:38]]></Time>
<TimeTick>1648575038</TimeTick>
<NodeArgs eType="Replay" icon="5" nRep="45" status="Failed" Source="D:\KeywordDrivenFramework\FunctionLibr\Library2.qfl" SourceLine="4" >
<Disp><![CDATA[Run Error]]></Disp>
</NodeArgs>
</Step>
<Step rID="T15">
<Obj plainTxt="False" ><![CDATA[OK]]></Obj>
<Details plainTxt="False" ><![CDATA[Cannot&nbsp;find&nbsp;the&nbsp;"OK"&nbsp;object's&nbsp;parent&nbsp;"HPE&nbsp;MyFlight&nbsp;Sample&nbsp;Applicatio"&nbsp;(class&nbsp;WpfWindow).<br/>Verify&nbsp;that&nbsp;parent&nbsp;properties&nbsp;match&nbsp;an&nbsp;object&nbsp;currently&nbsp;displayed&nbsp;in&nbsp;your&nbsp;application.]]></Details>
<Time><![CDATA[29/03/2022 - 23:00:52]]></Time>
<TimeTick>1648575052</TimeTick>
<Step rID="T16">
<Obj plainTxt="False" ><![CDATA[HPE MyFlight Sample Applicatio]]></Obj>
<Details plainTxt="False" ><![CDATA[Object's physical description:<br>wpftypename = window<br>regexpwndtitle = HPE MyFlight Sample Application<br>devname = HPE MyFlight Sample Application<br>]]></Details>
<Time><![CDATA[29/03/2022 - 23:00:53]]></Time>
<TimeTick>1648575053</TimeTick>
<NodeArgs eType="Replay" icon="5" nRep="55" status="Warning" nType="Parent description" Source="D:\KeywordDrivenFramework\FunctionLibr\Library2.qfl" SourceLine="-1" >
<Disp><![CDATA[HPE MyFlight Sample Applicatio]]></Disp>
</NodeArgs>
</Step>
<NodeArgs eType="Replay" icon="8" nRep="54" status="Failed" nType="Run Error" Source="D:\KeywordDrivenFramework\FunctionLibr\Library2.qfl" SourceLine="-1" >
<Disp><![CDATA[OK]]></Disp>
</NodeArgs>
</Step>
<Step rID="T17">
<Obj plainTxt="False" ><![CDATA[Stop Run]]></Obj>
<Details plainTxt="False" ><![CDATA[Run stopped by user.]]></Details>
<Time><![CDATA[29/03/2022 - 23:00:53]]></Time>
<TimeTick>1648575053</TimeTick>
<NodeArgs eType="General" icon="9" nRep="56" status="Information" >
<Disp><![CDATA[Stop Run]]></Disp>
</NodeArgs>
</Step>
<NodeArgs eType="Context" icon="6" nRep="44" status="Failed" Source="D:\KeywordDrivenFramework\FunctionLibr\Library2.qfl" SourceLine="-1" >
<Disp><![CDATA[HPE MyFlight Sample Applicatio]]></Disp>
</NodeArgs>
</Step>
<Summary sTime="29/03/2022 - 22:58:08" eTime="29/03/2022 - 23:00:53" passed="0" failed="6" warnings="3" ></Summary>
<NodeArgs eType="StartAction" icon="3" nRep="6" status="Failed" >
<Disp><![CDATA[Action1 Summary]]></Disp>
</NodeArgs>
</Action>
<Summary sTime="29/03/2022 - 22:58:06" eTime="29/03/2022 - 23:00:53" passed="0" failed="6" warnings="3" stopped="True" ></Summary>
<NodeArgs eType="StartTest" icon="1" nRep="3" status="Failed" >
<Disp><![CDATA[Test Driver Summary]]></Disp>
</NodeArgs>
</Doc>
</Report>